Label;Tanggal;Judul;Narasi;Source
0;09-Sep-24;Diduga Hendak Mencuri Kotak Amal, Pria di Bogor Ditangkap;Pria berinisial WG (59) ditangkap warga karena diduga hendak mencuri uang dalam kotak amal di musala Desa Mampir, Cileungsi, Kota Bogor. Aksinya gagal karena dipergoki warga.;https://news.detik.com/berita/d-7531721/diduga-hendak-mencuri-kotak-amal-pria-di-bogor-ditangkap
0;09-Sep-24;Drone MQ-9 Amerika Jadi Bulan-bulanan Houthi, 8 Unit Dijatuhkan Padahal 1 Unit Seharga Setengah Triliun;Drone tempur buatan General Atomics (Amerika Serikat), MQ-9 Reaper, ternyata menjadi bulan-bulanan kelompok bersenjata Yaman, Houthi.;https://www.zonajakarta.com/internasional/67313505893/drone-mq-9-amerika-jadi-bulan-bulanan-houthi-8-unit-dijatuhkan-padahal-1-unit-seharga-setengah-triliun
0;09-Sep-24;Eks Menhan Serukan Israel Alihkan Fokus ke Hizbullah di Lebanon;"Benny Gantz, mantan Menteri Pertahanan dan bekas anggota kabinet perang Israel, menyerukan Tel Aviv harus mengalihkan fokus kepada Hizbullah dan perbatasan Lebanon yang marak dilanda serangan. Gantz memperingatkan bahwa Israel sudah ""terlambat dalam hal ini"".";https://news.detik.com/internasional/d-7532422/eks-menhan-serukan-israel-alihkan-fokus-ke-hizbullah-di-lebanon
0;09-Sep-24;Elon Musk Iseng Jadi Si Kera Sakti Black Myth: Wukong;Pesona game Black Myth: Wukong memikat hati CEO Tesla Elon Musk. Dia pun iseng mengganti wajahnya jadi Si Kera Sakti;https://inet.detik.com/cyberlife/d-7531795/elon-musk-iseng-jadi-si-kera-sakti-black-myth-wukong
0;09-Sep-24;Fakta Terbaru Kasus Pasutri Lansia Tewas di Tangerang Kota;Pasangan suami-istri (pasutri) lanjut usia (lansia) ditemukan tewas 'berduaan' di dalam rumahnya di Cipondoh, Kota Tangerang. Kedua korban yaitu berinisial BK (70) dan RB (60). Terdapat luka terbuka di kedua tubuh korban.;https://news.detik.com/berita/d-7531292/fakta-terbaru-kasus-pasutri-lansia-tewas-di-tangerang-kota
0;09-Sep-24;Fenomena Equinox 22 September, Ini Dampaknya Terhadap Suhu Bumi;Fenomena Equinox akan terjadi lagi di September 2024, setelah sebelumnya telah berlangsung pada bulan Maret lalu.;https://www.celebesmedia.id/celebes/artikel/1008090924/fenomena-equinox-22-september-ini-dampaknya-terhadap-suhu-bumi
0;09-Sep-24;Fenomena Kamar Hotel 'Hantu' Gentayangan di Bali Selatan-Ini Ceritanya;Pemerintah berencana melakukan moratorium atau menangguhkan izin pembangunan hotel di Bali, khususnya Bali bagian Selatan. Hal ini sejalan untuk mengatasi persoalan berlebihannya kamar hotel di daerah tersebut. Rencana ini pun disambut baik oleh kalangan pelaku usaha hotel di Bali.;https://www.cnbcindonesia.com/news/20240909101349-4-570206/fenomena-kamar-hotel-hantu-gentayangan-di-bali-selatan-ini-ceritanya
0;09-Sep-24;FOTO: Vietnam Luluh Lantak Diterjang Topan Super Yagi;Sejumlah provinsi di Vietnam dilanda banjir parah akibat topan super Yagi yang menyapu wilayah itu selama beberapa hari terakhir.;https://www.cnnindonesia.com/internasional/20240909095152-108-1142407/foto-vietnam-luluh-lantak-diterjang-topan-super-yagi
0;09-Sep-24;Ganjil Genap Jakarta Tidak Berlaku Senin Pekan Depan;Skema pembatasan kendaraan dengan sistem ganjil genap rencananya tidak akan berlaku pada Senin (16/9/2024) pekan depan. Hal ini dilakukan karena adanya Libur Hari Maulid Nabi Muhammad SAW.;https://otomotif.kompas.com/read/2024/09/09/062200615/ganjil-genap-jakarta-tidak-berlaku-senin-pekan-depan
0;09-Sep-24;Gawat, Pesawat Nirawak Militer Rusia Jatuh di Negara NATO;Pemerintah Latvia, salah satu negara NATO, mengumumkan sebuah pesawat nirawak militer Rusia telah jatuh di wilayahnya.;https://international.sindonews.com/read/1451781/41/gawat-pesawat-nirawak-militer-rusia-jatuh-di-negara-nato-1725840587
0;09-Sep-24;Gempa Bumi Berpotensi Ciptakan Bongkahan Emas Raksasa;Gempa bumi memicu kuarsa membentuk bongkahan emas besar. Hal itu merupakan hasil dari sebuah studi terbaru yang akhirnya memecahkan misteri yang membingungkan para peneliti selama beberapa dekade.;https://www.detik.com/jatim/berita/d-7531212/gempa-bumi-berpotensi-ciptakan-bongkahan-emas-raksasa
0;09-Sep-24;Gilga Sahid Lempar Mikrofon saat Manggung di Cirebon, Ini Duduk Masalahnya;Penyanyi Gilga Sahid meluapkan kekecewaannya dengan melempar mikrofon saat manggung di salah satu mall di Cirebon, Jawa Barat. Video Gilga melempar mikrofon viral di media sosial.;https://www.detik.com/pop/music/d-7531522/gilga-sahid-lempar-mikrofon-saat-manggung-di-cirebon-ini-duduk-masalahnya
0;09-Sep-24;Gubernur Akpol Sebut Taruna Lawan Perwira Pengasuh Sudah Dikeluarkan;Gubernur Akademi Kepolisian (Akpol) Irjen Krisno Siregar menyebut taruna berinisial B yang sempat melawan perwira pengasuh saat ini sudah dikeluarkan dari Akpol. Dia menjelaskan sanksi tersebut dijatuhkan kepada B oleh Dewan Akademik.;https://www.cnnindonesia.com/nasional/20240909121609-12-1142492/gubernur-akpol-sebut-taruna-lawan-perwira-pengasuh-sudah-dikeluarkan
0;09-Sep-24;Heboh Pak Ogah di Bandung Pura-pura Terlindas Lalu Minta 'Uang Damai';Juru pengatur lalu lintas liar atau Pak Ogah di Bandung berulah. Mereka bikin resah pengendara luar kota dengan modus kaki pura-pura terlindas mobil lalu minta 'uang damai'.;https://www.detik.com/jabar/berita/d-7531375/heboh-pak-ogah-di-bandung-pura-pura-terlindas-lalu-minta-uang-damai
0;09-Sep-24;Herannya Tahanan soal Iuran di Rutan KPK: Masa buat Kopi Rp 20 Juta;Jaksa menghadirkan Kiagus Emil Fahmy Cornain sebagai salah satu saksi dalam sidang pungutan liar atau pungli di Rutan KPK. Kiagus mengaku sempat mengajukan protes terkait iuran untuk tahanan KPK.;https://news.detik.com/berita/d-7532434/herannya-tahanan-soal-iuran-di-rutan-kpk-masa-buat-kopi-rp-20-juta
0;09-Sep-24;Hoaks, Pj Bupati Brebes Terjangkit Monkeypox;Masyarakat diimbau mengabaikan hoaks tentang Penjabat (Pj) Bupati Brebes, Iwanuddin Iskandar, yang terjangkit penyakit Monkey Pox (Mpox) atau cacar monyet.;https://jatengprov.go.id/beritadaerah/hoaks-pj-bupati-brebes-terjangkit-monkeypox/
0;09-Sep-24;Ilmuwan AS Mengaku Tahu Cara Deteksi Gempa Bumi Sebulan Sebelumnya;Penelitian terbaru menemukan metode deteksi atau peringatan gempa besar. Bahkan peringatan tersebut diklaim bisa datang selama berhari-hari atau berbulan-bulan sebelumnya.;https://www.cnbcindonesia.com/tech/20240909065616-37-570155/ilmuwan-as-mengaku-tahu-cara-deteksi-gempa-bumi-sebulan-sebelumnya
0;09-Sep-24;India Isolasi Pasien Diduga Cacar Monyet Clade 1;Kementerian Kesehatan India mengumumkan telah mengisolasi pasien yang terkena penyakit cacar monyet (monkey pox/Mpox) clade 1. Juru bicara Kemenkes India, seperti dikutip VoA, menyatakan pihaknya telah menyiapkan langkah-langkah memadai untuk menangani situasi tersebut.;https://rri.co.id/internasional/962725/india-isolasi-pasien-diduga-cacar-monyet-clade-1
0;09-Sep-24;Intelijen AS Ungkap Iran Kirim Pasokan Rudal Balistik ke Rusia;Amerika Serikat menyebut Iran kembali membantu Rusia dengan memasok sejumlah rudal balistik ke negara sekutunya itu.;https://www.cnnindonesia.com/internasional/20240909084752-134-1142391/intelijen-as-ungkap-iran-kirim-pasokan-rudal-balistik-ke-rusia
0;09-Sep-24;Jannik Sinner Rebut Titel Juara US Open 2024;Unggulan teratas Jannik Sinner keluar sebagai pemenang US Open 2024. Petenis Italia itu mengalahkan unggulan 12 Taylor Fritz straight set di final.;https://sport.detik.com/raket/d-7531249/jannik-sinner-rebut-titel-juara-us-open-2024
0;09-Sep-24;Jokowi Ngantor di IKN Selama 40 Hari, Mulai Besok hingga Jelang Purnatugas;Presiden Joko Widodo (Jokowi) bakal berkantor di Ibu Kota Nusantara (IKN) mulai Selasa (10/9) besok. Presiden ke-7 RI itu akan berada di IKN sampai sehari jelang akhir masa jabatannya.;https://news.detik.com/berita/d-7531372/jokowi-ngantor-di-ikn-selama-40-hari-mulai-besok-hingga-jelang-purnatugas
0;09-Sep-24;Kadinkes: Subang Masih Aman dari Cacar Monyet;Kepala Dinas Kesehatan Kabupaten Subang dr. Maxi menegaskan, sampai sejauh ini, di Kabupaten Subang belum diketemukan adanya masyarakat yang terindikasi cacar monyet.;https://rri.co.id/kesehatan/964047/kadinkes-subang-masih-aman-dari-cacar-monyet
0;09-Sep-24;Kendaraan yang Tak Berhak Isi BBM Subsidi Sudah Divalidasi Korlantas;Badan Pengatur Hilir Minyak dan Gas Bumi (BPH Migas) menyampaikan telah menjalin kerja sama dengan Korlantas. Khususnya untuk memastikan akurasi data kendaraan bermotor yang digunakan dalam program BBM subsidi tepat sasaran.;https://www.cnbcindonesia.com/news/20240909085511-4-570186/kendaraan-yang-tak-berhak-isi-bbm-subsidi-sudah-divalidasi-korlantas
0;09-Sep-24;Ketua KPU Akui Mau Mundur Jika Putusan MK soal Pilkada Tak Bisa Jalan;Ketua KPU Mochammad Afifuddin mengaku sempat akan menandatangani surat pengunduran diri jika putusan Mahkamah Konstitusi (MK) tentang pilkada tidak diakomodasi dalam Peraturan KPU (PKPU).;https://www.cnnindonesia.com/nasional/20240909134511-617-1142538/ketua-kpu-akui-mau-mundur-jika-putusan-mk-soal-pilkada-tak-bisa-jalan
0;09-Sep-24;KKP gagalkan penyelundupan Rp12,15 miliar BBL di Bogor dan Bali;Tim Gabungan Kementerian Kelautan dan Perikanan (KKP) bersama Aparat Penegak Hukum (APH) berhasil menggagalkan penyelundupan Benih Bening Lobster (BBL) di Parung Panjang, Bogor, dan Bandara Internasional I Gusti Ngurah Rai, Bali. Dari dua lokasi tersebut, petugas gabungan mengamankan lebih dari 81.000 ekor BBL setara Rp12,15 miliar. (Sanya Dinda Susanti/Rizky Bagus Dhermawan/Farah Khadija);https://www.antaranews.com/video/4320339/kkp-gagalkan-penyelundupan-rp1215-miliar-bbl-di-bogor-dan-bali
0;09-Sep-24;KPK Batal Klarifikasi Bobby soal Jet Pribadi;Juru Bicara Komisi Pemberantasan Korupsi (KPK) Tessa Mahardhika Sugiarto mengatakan, Direktorat Gratifikasi KPK batal mengundang Wali Kota Medan Bobby Nasution untuk mengklarifikasi penggunaan pesawat jet pribadi.;https://nasional.kompas.com/read/2024/09/09/09142941/kpk-batal-klarifikasi-bobby-soal-jet-pribadi
0;09-Sep-24;Kronologi Pelajar di Labuhanbatu Diperkosa 12 Pria di Kebun Sawit-Kamar Kos;Seorang pelajar di Kabupaten Labuhanbatu, Sumatera Utara (Sumut) inisial RCV (17) diduga diperkosa 12 orang di kebun sawit dan kamar kos. Begini kronologinya.;https://www.detik.com/sumut/hukum-dan-kriminal/d-7532667/kronologi-pelajar-di-labuhanbatu-diperkosa-12-pria-di-kebun-sawit-kamar-kos
0;09-Sep-24;Lagi Asyik Jalan di Pantai, Menteri Kontroversial Israel Diteriaki Pembunuh;Saat lagi asyik berjalan-jalan di pantai, Menteri Keamanan Nasional Israel Itamar Ben-Gvir diusir oleh warganya sendiri. Ia juga diteriaki pembunuh!;https://travel.detik.com/travel-news/d-7531215/lagi-asyik-jalan-di-pantai-menteri-kontroversial-israel-diteriaki-pembunuh
0;09-Sep-24;Layanan E-Meterai Terganggu saat Pendaftaran CASN, Ombudsman RI Minta Penjelasan Pemerintah;Anggota Ombudsman RI, Robert Na Endi Jaweng meminta pemerintah memberikan penjelasan kepada publik perihal terkendalanya akses pembelian emeterai pada masa pendaftaran seleksi Calon Pegawai Negeri Sipil (CPNS) 2024.;https://www.beritasatu.com/network/eranasional/297545/layanan-e-meterai-terganggu-saat-pendaftaran-casn-ombudsman-ri-minta-penjelasan-pemerintah
0;09-Sep-24;Lurah di Bogor Ungkap Pemicu Sekelompok Pria Pukuli Tukang Nasi Uduk;Sekelompok pria menganiaya sejumlah orang, termasuk tukang nasi uduk, di Balumbangjaya, Bogor Barat, Kota Bogor. Penganiayaan terjadi karena pelaku tidak terima ditegur menggeber motor saat melintas.;https://news.detik.com/berita/d-7532860/lurah-di-bogor-ungkap-pemicu-sekelompok-pria-pukuli-tukang-nasi-uduk
0;09-Sep-24;Maroko Dilanda Banjir Hebat, 4 Orang Tewas-14 HIlang;Daerah Maroko bagian selatan dilanda banjir akibat fenomena iklim yang luar biasa. Pihak berwenang menyampaikan ada 4 orang tewas dan 14 lainnya hilang.;https://news.detik.com/internasional/d-7531239/maroko-dilanda-banjir-hebat-4-orang-tewas-14-hilang
0;09-Sep-24;Maroon 5 Konser di Jakarta 1 Februari 2025!;Kalian penggemar Maroon 5? Jangan mau ketinggalan dengan aksi panggung mereka yang bakal digelar pada 1 Februari 2025 di Jakarta nih.;https://www.detik.com/pop/music/d-7531530/maroon-5-konser-di-jakarta-1-februari-2025
0;09-Sep-24;Marquez Cetak Sejarah Usai Menang MotoGP San Marino 2024;Pembalap Gresini Racing Marc Marquez mencetak sejarah usai menang MotoGP San Marino 2024 di Sirkuit Misano, Minggu (8/9).;https://www.cnnindonesia.com/olahraga/20240909115932-156-1142486/marquez-cetak-sejarah-usai-menang-motogp-san-marino-2024
0;09-Sep-24;Meneteskan Air Mata, Basuki Pamit ke Komisi V DPR;Menteri Pekerjaan Umum dan Perumahan Rakyat (PUPR) Basuki Hadimuljono menyampaikan salam perpisahan kepada Komisi V DPR RI menjelang purnajabatan. Hal ini disampaikan langsung olehnya dalam Rapat Kerja (Raker) terakhir bersama Komisi V DPR RI.;https://finance.detik.com/infrastruktur/d-7532095/meneteskan-air-mata-basuki-pamit-ke-komisi-v-dpr
0;09-Sep-24;Meteor Meledak di Atas Langit Malam Filipina, Terekam Kamera Warga;Meteor kecil berdiameter sekitar 1 meter masuk atmosfer Bumi dan terbakar di atas Pulau Luzon di Filipina pada Kamis (5/8) kemarin. Detik-detik meteor itu jatuh banyak disaksikan warga dan berhasil diabadikan kamera ponsel.;https://kumparan.com/kumparansains/meteor-meledak-di-atas-langit-malam-filipina-terekam-kamera-warga-23THoUWiEMV
0;09-Sep-24;nnova Zenix yang Dipakai Paus Fransiskus Tak Akan Dijual, Jadi Milik Kedubes Vatikan;Mobil Toyota Kijang Innova Zenix yang digunakan Paus Fransiskus saat berkunjung ke Indonesia menjadi milik Kedutaan Besar Vatikan.;https://megapolitan.kompas.com/read/2024/09/09/08262481/innova-zenix-yang-dipakai-paus-fransiskus-tak-akan-dijual-jadi-milik
0;09-Sep-24;Nyali Modal Patungan, Pelaku yang Bully Siswa SMK di Bogor Hingga Tewas Ternyata Pengecut;Polisi saat ini tengah memburu seorang siswa SMK di Bogor berinisial KOS.;https://bogor.tribunnews.com/2024/09/09/nyali-modal-patungan-pelaku-yang-bully-siswa-smk-di-bogor-hingga-tewas-ternyata-pengecut
0;09-Sep-24;Nyoman Sukena Terancam 5 Tahun Penjara Gara-gara Pelihara Landak Jawa;Seorang warga bernama I Nyoman Sukena asal Kabupaten Badung, Bali, terancam lima tahun penjara karena memelihara empat ekor landak Jawa langka di rumahnya.;https://www.cnnindonesia.com/nasional/20240909122246-12-1142497/nyoman-sukena-terancam-5-tahun-penjara-gara-gara-pelihara-landak-jawa
0;09-Sep-24;Pandemic Fund Kucurkan US$ 500 Juta untuk Negara Terdampak Cacar Monyet;Pandemic Fund telah mengadakan rapat Dewan Darurat pada Jumat, 6 September 2023 untuk membahas terkait penanganan wabah monkeypox (Mpox) atau cacar monyet yang sedang berlangsung.;https://nasional.kontan.co.id/news/pandemic-fund-kucurkan-us-500-juta-untuk-negara-terdampak-cacar-monyet
0;09-Sep-24;Pemukim Ekstremis Israel Kian Gencar Rebut Tanah Warga Palestina;Pada Oktober silam, seorang nenek Palestina, Ayesha Shtayyeh mengatakan bahwa seorang laki-laki menodongkan pistol ke kepalanya lalu menyuruhnya meninggalkan rumah yang telah dia tinggali selama 50 tahun.;https://news.detik.com/bbc-world/d-7531654/pemukim-ekstremis-israel-kian-gencar-rebut-tanah-warga-palestina
0;09-Sep-24;Perang Arab Meluas! Israel Serbu Negara Baru, Iran Ngamuk;Perang Israel dengan beberapa milisi Arab kembali meluas. Setelah sebelumnya melibatkan Lebanon dan Yaman, kali ini Negeri Yahudi menyerbu Suriah, Minggu.;https://www.cnbcindonesia.com/news/20240909174909-4-570381/perang-arab-meluas-israel-serbu-negara-baru-iran-ngamuk
0;09-Sep-24;Perpusatakaan Daerah Ajukan Penambahan Koleksi Buku Khusus Anak;Dinas Perpustakaan dan Kearsipan Daerah Kabupaten Malinau berupaya memperkaya koleksi buku di perpustakaan guna memenuhi kebutuhan literasi masyarakat, khususnya anak-anak. Kepala Dinas Perpustakaan dan Kearsipan Malinau, Sergius, mengungkapkan bahwa pihaknya telah mengajukan permohonan penambahan koleksi buku kepada Perpustakaan Nasional, terutama buku-buku yang lebih sesuai untuk anak-anak.;https://www.rri.co.id/daerah/963394/perpusatakaan-daerah-ajukan-penambahan-koleksi-buku-khusus-anak
0;09-Sep-24;Pesawat Luar Angkasa China Kembali ke Bumi, Misinya Penuh Rahasia;Pesawat luar angkasa China mendarat di Gurun Gobi setelah menghabiskan waktu 268 hari di orbitnya. Misinya rahasia, namun beberapa rekaman menunjukkan pesawat ini melepaskan sejumlah objek di orbit.;https://sains.sindonews.com/read/1451927/767/pesawat-luar-angkasa-china-kembali-ke-bumi-misinya-penuh-rahasia-1725854964
0;09-Sep-24;Planetarium Jakarta Gelar Pengamatan Oposisi Saturnus Nanti Malam, Gas Daftar!;Fenomena antariksa akan kembali menghiasi langit. Kali ini, Planetarium Jakarta menggelar pengamatan Planet Saturnus Senin (9/9/2024) malam.;https://www.detik.com/edu/detikpedia/d-7530807/planetarium-jakarta-gelar-pengamatan-oposisi-saturnus-nanti-malam-gas-daftar
0;09-Sep-24;Pohon Tumbang Tutup Jalan Ciampea Bogor;Hujan deras di sertai angin kencang porak porandakan warga di Ciampea, Kabupaten Bogor, Senin (9/9/2024) sore.;https://www.rri.co.id/bogor/daerah/963817/pohon-tumbang-tutup-jalan-ciampea-bogor
0;09-Sep-24;Polisi Buru Terduga Pelaku Pembunuhan Gadis Remaja di Padang Pariaman;Penemuan jasad NKS, gadis remaja berusia 18 tahun asal Korong Pasar Surau, Nagari Guguak, Kecamatan 2?11 Kayu Tanam, Kabupaten Padang Pariaman, Sumatera Barat dalam kondisi terkubur tanpa busana, hingga kini masih menjadi misteri.;https://padang.viva.co.id/ragam-perkara/4266-polisi-buru-terduga-pelaku-pembunuhan-gadis-remaja-di-padang-pariaman
0;09-Sep-24;Polisi Minta Pengendara Mobil Penabrak Restoran di Senopati Kooperatif;Polisi masih menyelidiki kasus mobil Toyota Innova Zenix yang menabrak restoran Jepang di kawasan Senopati, Jakarta Selatan. Polisi telah mengecek ke alamat si pengemudi, tapi yang bersangkutan tidak ada di rumahnya.;https://news.detik.com/berita/d-7531464/polisi-minta-pengendara-mobil-penabrak-restoran-di-senopati-kooperatif
0;09-Sep-24;Polisi Selidiki Pengemudi Viral Pamer Senpi di Jakarta Timur;Kejadian yang memperlihatkan seorang pengemudi Mitsubishi Pajero memamerkan benda yang diduga senjata api viral media sosial.;https://jabarekspres.com/berita/2024/09/09/polisi-selidiki-pengemudi-viral-pamer-senpi-di-jakarta-timur/
0;09-Sep-24;Pria di Ciomas Bogor Dibacok Saat Bubarkan Konvoi Geng Motor Bercelurit;Pria bernama Harun Alif Arrasyd (22) menjadi korban pembacokan geng motor di Jl Raya Ciomas, Kabupaten Bogor, Jawa Barat. Saat kejadian, korban hendak membubarkan konvoi geng motor bersenjata tajam tersebut.;https://news.detik.com/berita/d-7532907/pria-di-ciomas-bogor-dibacok-saat-bubarkan-konvoi-geng-motor-bercelurit
0;09-Sep-24;Puluhan Tentara Bayaran Ukraina Jadi Mayat, Pasukan Rusia Gempur Stetkovka;Militer Rusia melancarkan serangan besar-besaran di Oblast (Provinsi) Sumy, Ukraina, Minggu 8 September 2024 waktu setempat. Sasarannya adalah desa Stetkovka, yang disinyalir menjadi basis tentara bayaran asing.;https://www.viva.co.id/militer/militer-dunia/1750038-puluhan-tentara-bayaran-ukraina-jadi-mayat-pasukan-rusia-gempur-stetkovka
0;09-Sep-24;Putin dan Xi Jinping Beri Ucapan Selamat ke Kim Jong-Un: Bukti Korea Utara, China, Rusia Makin Erat;Presiden Rusia Vladimir Putin dan Presiden China Xi Jinping memberi ucapan selamat kepada pemimpin Korea Utara Kim Jong-un.;https://www.kompas.tv/internasional/536904/putin-dan-xi-jinping-beri-ucapan-selamat-ke-kim-jong-un-bukti-korea-utara-china-rusia-makin-erat
0;09-Sep-24;Radar China Deteksi Gelembung Plasma di Atas Piramida Giza;Radar China berhasil mendeteksi gelembung plasma di atas piramida Mesir dan Kepulauan Midway dari jarak ribuan kilometer. Gelembung plasma ekuatorial adalah peristiwa cuaca yang tidak biasa di daerah lintang rendah, disebabkan oleh hilangnya partikel bermuatan secara tiba-tiba di ionosfer, lapisan atmosfer bagian atas Bumi.;https://sains.sindonews.com/read/1451829/768/radar-china-deteksi-gelembung-plasma-di-atas-piramida-giza-1725844155
0;09-Sep-24;RI Bakal Punya Gudang Penyangga Bensin & LPG, di Sini Lokasinya..;Pemerintah RI terus berupaya memperkuat ketahanan energi nasional. Hal ini dibuktikan dengan ditetapkannya Peraturan Presiden Nomor 96 Tahun 2024 tentang Cadangan Penyangga Energi (CPE). Penandatanganan Perpres ini menandai langkah konkret pemerintah dalam memastikan ketersediaan energi yang stabil dan terjangkau bagi seluruh masyarakat Indonesia.;https://www.cnbcindonesia.com/news/20240909102140-4-570208/ri-bakal-punya-gudang-penyangga-bensin-lpg-di-sini-lokasinya
0;09-Sep-24;Semangat Maarten Paes Tak Sabar Bela Timnas Indonesia di GBK, Terungkap Biaya yang Harus Dikeluarkan PSSI Boyong Sang Kiper, NilainyaÉ;Kiper berbakat asal Belanda, Maarten Paes menjadi sorotan setelah resmi memperkuat Timnas Indonesia.;https://www.tvonenews.com/bola/timnas/244243-semangat-maarten-paes-tak-sabar-bela-timnas-indonesia-di-gbk-terungkap-biaya-yang-harus-dikeluarkan-pssi-boyong-sang-kiper-nilainya
0;09-Sep-24;Siap-Siap Keluarin Kocek Lebih! Tarif Tol Dalam Kota Segera Naik;Dalam waktu dekat, para pengguna Tol Dalam Kota harus mengeluarkan kocek lebih. Pasalnya PT Jasamarga Metropolitan Tollroad sebagai pengelola Jalan Tol Dalam Kota dan Sedyatmo akan menaikkan tarif.;https://www.cnbcindonesia.com/news/20240909105043-4-570221/siap-siap-keluarin-kocek-lebih-tarif-tol-dalam-kota-segera-naik
0;09-Sep-24;Sombongnya Pelatih Timnas Malaysia Usai Raih Gelar Juara hingga Geser Ranking FIFA Timnas Indonesia: Kami Punya Pemain Berkualitas;Pelatih Timnas Malaysia, Pau Marti Vicente memberikan reaksi setelah tim berjuluk Harimau Malaya itu meraih gelar juara hingga menggeser ranking FIFA Timnas Indonesia.;https://www.tvonenews.com/bola/timnas/244198-sombongnya-pelatih-timnas-malaysia-usai-raih-gelar-juara-hingga-geser-ranking-fifa-timnas-indonesia-kami-punya-pemain-berkualitas
0;09-Sep-24;Sopir Truk Kontainer Jatuh dari Atas Tol Cibitung Diduga Mengantuk;Satu unit truk kontainer terlibat kecelakaan tunggal hingga terjatuh dari atas Tol Cibitung-Cilincing ke lahan kosong di kawasan Cikarang, Kabupaten Bekasi, Jawa Barat (Jakbar). Kecelakaan diduga lantaran sopir mengantuk saat berkendara.;https://news.detik.com/berita/d-7532189/sopir-truk-kontainer-jatuh-dari-atas-tol-cibitung-diduga-mengantuk
0;09-Sep-24;Tahanan Ngaku Setor Rp 140 Juta gegara Takut Dikunci Terus di Sel Rutan KPK;Jaksa KPK menghadirkan Wawan Ridwan sebagai saksi kasus pungutan liar atau pungli di Rutan KPK. Wawan mengaku menyetor total Rp 140 juta selama ditahan di Rutan KPK karena takut dikunci di dalam selnya.;https://news.detik.com/berita/d-7532326/tahanan-ngaku-setor-rp-140-juta-gegara-takut-dikunci-terus-di-sel-rutan-kpk
0;09-Sep-24;Tawuran Bersenjata Tajam di Jakpus Makan Korban Jiwa, 1 Remaja Tewas;Tawuran pecah hingga menelan korban jiwa terjadi di Jalan Pangeran Jayakarta, Mangga Besar, Sawah Besar, Jakarta Pusat. Tawuran tersebut menewaskan satu orang remaja.;https://news.detik.com/berita/d-7531515/tawuran-bersenjata-tajam-di-jakpus-makan-korban-jiwa-1-remaja-tewas
0;09-Sep-24;Teleskop NASA Pecahkan Misteri Objek Berbentuk Tanda Tanya di Galaksi;Teleskop Antariksa James Webb (JWST) baru-baru ini berhasil menemukan jawaban soal objek berbentuk tanda tanya yang terlihat di galaksi. Simak penjelasannya.;https://www.cnnindonesia.com/teknologi/20240909132314-199-1142514/teleskop-nasa-pecahkan-misteri-objek-berbentuk-tanda-tanya-di-galaksi
0;09-Sep-24;Terima Donasi Rak Buku Multifungsi dari MNC Peduli, Kampung Ilmu Limo: Membaca Itu Jendela Dunia;MNC Peduli kembali menyambangi taman literasi masyarakat di Kampung Ilmu Kelurahan Limo, Kecamatan Limo, Depok, Senin (9/9/2024) pagi. Diketahui MNC Peduli menyerahkan rak buku multifungsi, buku bacaan, dan aktivitas luar ruangan dalam rangka mengasah motorik anak.;https://news.okezone.com/read/2024/09/09/1/3060552/terima-donasi-rak-buku-multifungsi-dari-mnc-peduli-kampung-ilmu-limo-membaca-itu-jendela-dunia
0;09-Sep-24;Toyota Tanggapi Periklindo yang Tolak Insentif Hybrid;Toyota Tanggapi Periklindo yang Tolak Insentif Hybrid;https://otomotif.kompas.com/read/2024/09/09/072200215/toyota-tanggapi-periklindo-yang-tolak-insentif-hybrid
0;09-Sep-24;Truk Tangki BBM Meledak Usai Tabrakan Beruntun, 52 Orang Tewas;Sebuah truk tangki bahan bakar meledak di Negara Bagian Niger, Nigeria Utara, Minggu waktu setempat. Dalam insiden itu, 52 orang tewas.;https://www.cnbcindonesia.com/news/20240909182504-4-570402/truk-tangki-bbm-meledak-usai-tabrakan-beruntun-52-orang-tewas
0;09-Sep-24;Unhan Bersihkan Sampah Pluit;Penjabat Gubernur Jakarta, Heru Budi Hartono, mengapresiasi sinergi pemprov Jakarta dengan Universitas Pertahanan (Unhan) untuk membersihkan sampah di daerah Pluit. Pemerintah Provinsi Jakarta dan Unhan membersihkan sampah di kawasan Pluit, Penjaringan, Jakarta Utara, Sabtu.;https://koran-jakarta.com/unhan-bersihkan-sampah-pluit?page=all
0;09-Sep-24;VIDEO: Proses Sekaten di Solo Ricuh Dipicu Debat soal Tabuh Gamelan;Prosesi Ngungelaken Gangsa Sekaten di Surakarta pada Senin (9/9) diwarnai kericuhan. Kericuhan berawal dari perdebatan soal siapa yang berhak menabuh gamelan untuk pertama kali. Prosesi itu awalnya digalangi oleh kubu LDA pimpinan GKR Wandansari. Kubu itu diketahui sedang berkonflik dengan pihak SISKS Pakubuwana XIII Hangabehi. Tak lama setelah prosesi dimulai, menantu SISKS Pakubuwana XIII, KRA Rizki Baruna Aji, datang ke lokasi dikawal pesilat Pagar Nusa. Kedatangan Rizki pun memicu emosi sejumlah abdi dalem hingga aksi saling dorong tak terhindarkan. Rizki pun dilaporkan jadi korban pendorongan hingga dicekik oleh orang tak dikenal.;https://www.cnnindonesia.com/nasional/20240909174027-24-1142655/video-proses-sekaten-di-solo-ricuh-dipicu-debat-soal-tabuh-gamelan
0;10-Sep-24;Angkasa Pura I dan II Resmi Merger, Jadi Operator Bandara Terbesar ke-5 Dunia;Pemerintah resmi menggabungkan atau merger PT Angkasa Pura I (Persero) atau AP I dan PT Angkasa Pura II (Persero) atau AP II, Senin (9/9/2024). Kedua operator bandara pelat merah ini resmi bergabung menjadi PT Angkasa Pura Indonesia (InJourney Airports).;https://id.investing.com/news/general/angkasa-pura-i-dan-ii-resmi-merger-jadi-operator-bandara-terbesar-ke5-dunia-2614414
