Label;Tanggal;Judul;Narasi;Source
1;18-Jul-24;"Penerimaan Pegawai BUMN Jalur
Universitas Lambung Mangkurat";"Penerimaan pegawai Badan Usaha Milik Negara (BUMN) jalur Universitas Lambung Mangkurat (ULM). Adapun email tersebut ditujukan kepada alumni, mahasiswa dan masyarakat setempat. Dalam email tersebut, mahasiswa atau masyarakat diharuskan mengisi data pribadi.
";https://www.instagram.com/ulmpascasarjana/p/C9Ki953tf17/
1;18-Jul-24;Penerimaan Pegawai BUMN Jalur Universitas Lambung Mangkurat;Beredar sebuah tangkapan layar sebuah email berisi informasi penerimaan pegawai Badan Usaha Milik Negara (BUMN) jalur Universitas Lambung Mangkurat (ULM). Adapun email tersebut ditujukan kepada alumni, mahasiswa dan masyarakat setempat. Dalam email tersebut, mahasiswa atau masyarakat diharuskan mengisi data pribadi.;https://ppid.diskominfo.jatengprov.go.id/isu-hoaks-disinformasi-18-juli-2024/
1;18-Jul-24;Pengobatan Ida Dayak di Kota Semarang pada Tanggal 2 Agustus 2024-6 Agustus 2024;Beredar informasi yang mengeklaim akan diadakan praktik pengobatan Ida Dayak di Gedung Wanita Kota Semarang, Provinsi Jawa Tengah pada tanggal 2-6 Agustus 2024. Informasi tersebut diketahui dari sejumlah unggahan baik di media sosial Facebook maupun WhatsApp.;https://ppid.diskominfo.jatengprov.go.id/isu-hoaks-disinformasi-18-juli-2024/
1;18-Jul-24;Pengobatan Mata Rabun Menggunakan Tanaman Patikan Kebo;Beredar sebuah unggahan yang mengeklaim penggunaan air rebusan dari tanaman patikan kebo yang bisa menyembuhkan mata buram.;https://ppid.diskominfo.jatengprov.go.id/isu-hoaks-disinformasi-18-juli-2024/
1;18-Jul-24;Seduhan Bawang Putih, Jahe, dan Kunyit Bisa Bersihkan Paru-paru;Beredar sebuah video pada media sosial Facebook yang mengeklaim bahwa seduhan bawang putih, jahe, dan kunyit mampu membersihkan paru-paru dari lendir serta asap rokok.;https://ppid.diskominfo.jatengprov.go.id/isu-hoaks-disinformasi-17-juli-2024/
1;18-Jul-24;"Tsunami Akan Terjang Wilayah Gorontalo
pada Juli 2024";"Tsunami yang akan menerjang Gorontalo pada bulan Juli 2024. Disebutkan pula terdengar sirine sebagai tanda akan tsunami dan adanya kenaikan permukaan air di Jembatan Talumolo, Kota Gorontalo.
";https://turnbackhoax.id/2024/07/17/salah-tsunami-akan-terjang-gorontalo-juli-2024/
1;18-Jul-24;Tsunami Akan Terjang Wilayah Gorontalo pada Juli 2024Dalam unggahan juga disertakan tautan yang diklaim untuk mendaftar di undian tersebut;Beredar sebuah unggahan foto di media sosial Facebook yang memperlihatkan obrolan tentang akan adanya tsunami yang akan menerjang Gorontalo pada bulan Juli 2024. Disebutkan pula terdengar sirine sebagai tanda akan tsunami dan adanya kenaikan permukaan air di Jembatan Talumolo, Kota Gorontalo.;https://ppid.diskominfo.jatengprov.go.id/isu-hoaks-disinformasi-18-juli-2024/
1;18-Jul-24;Vaksin COVID-19 Mengandung Logam Berat;Sedang memasukan cairan yang mengandung Racun logam berat ke Tubuh. Sejak di suntikkan maka dalam 2 Tahun ke depan, hampir semua penerima Vaksin COVID Vaksin paling beracun di dunia ini akan terkena serangan jantung/stroke,kanker ganas, infertil, gagal ginjal.;https://www.instagram.com/reel/C9ifJKMNiDh/
1;19-Jul-24;Akun Facebook Bagikan Link Pendaftaran Undian BJB;Beredar sebuah akun Facebook yang menginfokan mengenai undian berhadiah dari Bank BJB. ;https://ppid.diskominfo.jatengprov.go.id/isu-hoaks-disinformasi-19-juli-2024/
1;19-Jul-24;Mengobati Sesak Nafas dengan Pijat Tangan;Beredar sebuah unggahan video reels pada media sosial Facebook berisi tata cara pengobatan sesak nafas dan nyeri dada dengan memijat lengan tangan selama 10 menit.;https://ppid.diskominfo.jatengprov.go.id/isu-hoaks-disinformasi-19-juli-2024/
1;19-Jul-24;Tinta Tak Kasat Mata Dimasukkan ke Vaksin;Beredar sebuah unggahan di media sosial Instagram yang mengklaim bahwa tinta tak kasat mata dimasukkan ke vaksin. Pekerjaan ini didanai oleh Bill and Melinda Gates Foundation karena permintaan langsung dari pendiri Microsoft dan filantropis Bill Gates.;https://ppid.diskominfo.jatengprov.go.id/isu-hoaks-disinformasi-19-juli-2024/
1;19-Jul-24;Video Taswin Zakaria Membagikan Metode Praktis Hasilkan Kekayaan Triliunan di Pasar Saham;Beredar sebuah video di media sosial Facebook yang memperlihatkan mantan Presiden Direktur PT Bank Maybank Indonesia Tbk, Taswin Zakaria sedang berbicara. Narasi pada video mengeklaim bahwa Taswin Zakaria menawarkan metode praktis dalam menghasilkan kekayaan triliunan di pasar saham.;https://ppid.diskominfo.jatengprov.go.id/isu-hoaks-disinformasi-19-juli-2024/
1;20-Jul-24;Akun WhatsApp Mengatasnamakan Rektor Universitas Pendidikan Ganesha;Beredar akun WhatsApp mengatasnamakan Rektor Universitas Pendidikan Ganesha (UNDIKSHA) Prof. Dr. I Wayan Lasmawan, M.Pd. Akun tersebut menggunakan nomor +6281244896421.;https://ppid.diskominfo.jatengprov.go.id/isu-hoaks-disinformasi-20-juli-2024/
1;20-Jul-24;Jusuf Hamka Seret Menkeu ke KPK Soal Hutang Negara;Beredar sebuah unggahan di media sosial YouTube yang menyatakan bahwa Jusuf Hamka seret Menteri Keuangan (Menkeu) Sri Mulyani ke Komisi Pemberantasan Korupsi (KPK) soal hutang negara.;https://ppid.diskominfo.jatengprov.go.id/isu-hoaks-disinformasi-20-juli-2024/
1;20-Jul-24;Pesan WhatsApp Penawaran Kemudahan Masuk UNESA;Beredar pesan WhatsApp yang berisi penawaran kemudahan masuk Universitas Negeri Surabaya (UNESA). Dalam pesan tersebut menyebutkan mengenai masuk UNESA dengan cara mudah yang ditujukan bagi anak-anak muda lulusan SMA yang tinggal di sekitar kampus UNESA dan belum lolos tes masuk perguruan tinggi.;https://ppid.diskominfo.jatengprov.go.id/isu-hoaks-disinformasi-20-juli-2024/
1;20-Jul-24;Undian Berhadiah Mengatasnamakan Bank Aceh;Beredar sebuah unggahan foto di media sosial Facebook yang mengeklaim adanya undian berhadiah dari Bank Aceh. Nasabah dapat melakukan pendaftaran undian tersebut dengan mengeklik tautan yang tersedia.;https://ppid.diskominfo.jatengprov.go.id/isu-hoaks-disinformasi-20-juli-2024/
1;20-Jul-24;Video Anies Baswedan dan Ustaz Abdul Somad Jualan Kaos untuk Donasi ke Palestina;Beredar sebuah video di media sosial Facebook yang mengunggah pada 9 Mei yang menampilkan Anies Baswedan dan Ustaz Abdul Somad sedang melakukan promosi penjualan kaos untuk didonasikan ke Palestina.;https://ppid.diskominfo.jatengprov.go.id/isu-hoaks-disinformasi-20-juli-2024/
1;20-Jul-24;Video Hasil Persilangan Harimau dan Anjing Laut;Beredar sebuah unggahan di media sosial TikTok yang mengeklaim adanya sebuah video yang menampilkan seekor binatang dengan wajah harimau namun berbadan anjing laut. Unggahan tersebut juga disertai narasi yang menyebutkan bahwa hal itu merupakan hasil persilangan antara hewan harimau dengan anjing laut. Video tersebut diunggah pada 11 Juli 2024 dan telah dilihat sebanyak 4,4 juta tayangan.;https://ppid.diskominfo.jatengprov.go.id/isu-hoaks-disinformasi-20-juli-2024/
1;22-Jul-24;Akun WhatsApp Mengatasnamakan Pj Bupati Tanggamus Mulyadi Irsan;Beredar akun WhatsApp yang mengatasnamakan Penjabat (Pj) Bupati Tanggamus Mulyadi Irsan. Akun tersebut mengirim pesan kepada para takmir masjid yang menjanjikan akan memberikan bantuan masjid.;https://ppid.diskominfo.jatengprov.go.id/isu-hoaks-disinformasi-22-juli-2024/
1;22-Jul-24;Akun WhatsApp Mengatasnamakan Wakil Rektor Institut Teknologi Sepuluh Nopember Surabaya;Beredar akun WhatsApp mengatasnamakan Wakil Rektor 1 Institut Teknologi Sepuluh Nopember (ITS) Surabaya Prof. Nurul Widiastuti. Akun tersebut meminta pulsa ke civitas akademika kampus ITS Surabaya.;https://ppid.diskominfo.jatengprov.go.id/isu-hoaks-disinformasi-22-juli-2024/
1;22-Jul-24;Artikel Detik Berjudul ÒDeretan Kasus Biarawati Jadi Budak Seks Pastor Sejak 1990-anÓ;"Beredar sebuah unggahan di media sosial Facebook dengan narasi ""CBA TNYA KE MAMAK LU. BRP THN DIA JD L0NT3 DI G3R3JA"". Unggahan yang diunggah pada tanggal 30 Juni tersebut menggunakan tangkapan layar detiknews dengan foto Paus dan seorang perempuan.";https://ppid.diskominfo.jatengprov.go.id/isu-hoaks-disinformasi-22-juli-2024/
1;22-Jul-24;Covid-19 adalah Kebohongan para Ilmuan;Beredar sebuah narasi di sosial media pada 18 Mei 2024 bahwa virus Covid-19 adalah Kebohongan para Ilmuan.;https://ppid.diskominfo.jatengprov.go.id/isu-hoaks-disinformasi-22-juli-2024/
1;22-Jul-24;Dua Remaja Tewas karena Mabuk Kecubung;Beredar sebuah video di media sosial Facebook yang menampilkan dua remaja yang sedang mabuk. Keduanya diduga mabuk kecubung oplosan. Narasi unggahan juga menyebutkan bahwa akibat mabuk kecubung, dua orang meninggal dunia di Banjarmasin dan puluhan lainnya dirawat di Rumah Sakit Jiwa (RSJ) Sambang Lihum, Kecamatan Gambut, Kabupaten Banjar, Kalimantan Selatan (Kalsel).;https://ppid.diskominfo.jatengprov.go.id/isu-hoaks-disinformasi-22-juli-2024/
1;22-Jul-24;KLB Polio Disebabkan Vaksin Polio Tipe-2;Beredar sebuah unggahan video di media sosial Instagram yang mengeklaim pemberian vaksin polio tipe-2 kepada anak-anak justru dapat memicu adanya wabah penyakit polio di Indonesia.;https://ppid.diskominfo.jatengprov.go.id/isu-hoaks-disinformasi-22-juli-2024/
1;22-Jul-24;Video Wawancara Metro TV Promosikan Situs Judi Online;Beredar sebuah cuplikan video wawancara yang dilakukan oleh presenter Metro TV kepada seorang wanita. Video tersebut terlihat mencantumkan sebuah situs judi online dengan narasi bahwa mereka memberikan kemenangan kepada pemain baru. Ia menyebutkan, para pemain sudah pasti untung dan tidak akan rugi.;https://ppid.diskominfo.jatengprov.go.id/isu-hoaks-disinformasi-22-juli-2024/
1;23-Jul-24;Parfum, Pengharum Ruangan, dan Wangi Dry Clean Sebagai Penyebab Kanker;Beredar sebuah unggahan di media sosial Facebook yang mengklaim bahwa penggunaan parfum, pengharum ruangan, aromaterapi, dan dry clean sebagai penyebab kanker.;https://ppid.diskominfo.jatengprov.go.id/isu-hoaks-disinformasi-23-juli-2024/
1;23-Jul-24;Pemberian Izin Usaha kepada PT I-Mitra Mengatasnamakan OJK;Beredar sebuah gambar yang menampilkan surat yang mengatasnamakan Otoritas Jasa Keuangan (OJK) dalam bentuk surat pengumuman dengan Nomor PENG-12/D.147.2021. Surat tersebut berisikan tentang pemberian izin usaha investasi trading kepada PT I-Mitra.;https://ppid.diskominfo.jatengprov.go.id/isu-hoaks-disinformasi-23-juli-2024/
1;23-Jul-24;Tautan Pendaftaran Barcode Subsidi BBM Pertamina Tanpa KTP;Beredar sebuah unggahan di media sosial Facebook yang mengatasnamakan Pertamina. Unggahan tersebut menyertakan sebuah tautan pendaftaran barcode subsidi BBM (Bahan Bakar Minyak) Pertamina tanpa menyertakan KTP (Kartu Tanda Penduduk) dan STNK (Surat Tanda Nomor Kendaraan) sebagai persyaratan.;https://ppid.diskominfo.jatengprov.go.id/isu-hoaks-disinformasi-23-juli-2024/
1;23-Jul-24;Video Raffi Ahmad Bagikan Hadiah melalui Nomor WhatsApp;Beredar sebuah video di media sosial Instagram pada tanggal 19 juni 2024 yang mengatasnamakan raffi_nagitaberbagi221. Video selebritas Raffi Ahmad membagikan hadiah melalui nomor WhatsApp. Dalam video Raffi juga mengatakan demikian: Kalian mau hadiah apa? Kita akan kasih. Bisa jadi rumah, mobil, motor, uang, emas, mesin cuci, tv, apapun itu.;https://ppid.diskominfo.jatengprov.go.id/isu-hoaks-disinformasi-23-juli-2024/
1;23-Jul-24;Video Uji Coba Vaksin Pfizer Digunakan untuk Mengendalikan Pikiran Manusia;Beredar sebuah unggahan video di media sosial Instagram yang diklaim sebagai uji coba suntikan vaksin Pfizer untuk mengendalikan pikiran manusia. Narator menjelaskan bahwa isi botol vaksin Pfizer Covid mengandung graphene oksida, parasit, RFID, logam, dan sirkuit nano.;https://ppid.diskominfo.jatengprov.go.id/isu-hoaks-disinformasi-23-juli-2024/
1;23-Jul-24;Warga Satu Kampung Mendadak Kaya karena Judi Online;Beredar sebuah video di media sosial Facebook yang mengklaim warga satu kampung di Kuningan mendadak menjadi kaya karena judi online.;https://ppid.diskominfo.jatengprov.go.id/isu-hoaks-disinformasi-23-juli-2024/
1;24-Jul-24;Akun Facebook Fauzan Khoiri Denin Pj Bupati Empat Lawang;Beredar sebuah akun di media sosial Facebook yang mengatasnamakan Penjabat (Pj.) Bupati Empat Lawang Fauzan Khoiri Denin menuliskan kalimat tak pantas dalam bahasa daerah yang ditujukan kepada eks Bupati Empat Lawang Joncik Muhammad.;https://ppid.diskominfo.jatengprov.go.id/isu-hoaks-disinformasi-24-juli-2024/
1;24-Jul-24;Akun WhatsApp Mengatasnamakan Kadisperkim Kabupaten Garut Drs. Ahmad Mulyana;Beredar akun WhatsApp yang mengatasnamakan Kepala Dinas Perumahan dan Permukiman Kabupaten Garut (Kadisperkim) Drs. Ahmad Mulyana. Akun tersebut terlihat menggunakan foto profil Drs. Ahmad Mulyana.;https://ppid.diskominfo.jatengprov.go.id/isu-hoaks-disinformasi-24-juli-2024/
1;24-Jul-24;Akun WhatsApp Mengatasnamakan Kepala Diskominfo Kota Bogor Rahmat Hidayat;Beredar nomor WhatsApp yang mengatasnamakan Kepala Dinas Komunikasi dan Informatika (Diskominfo) Kota Bogor Rahmat Hidayat. Nomor WhatsApp tersebut menggunakan foto profil Rahmat Hidayat.;https://ppid.diskominfo.jatengprov.go.id/isu-hoaks-disinformasi-24-juli-2024/
1;24-Jul-24;Akun WhatsApp Mengatasnamakan Pj Bupati Kapuas;Beredar akun WhatsApp mengatasnamakan Penjabat (Pj) Bupati Kabupaten Kapuas, Erlin Hardi. Akun tersebut menggunakan nama dan foto profil Pj. Bupati Kapuas Erlin Hardi dengan nomor +6282189141719.;https://ppid.diskominfo.jatengprov.go.id/isu-hoaks-disinformasi-24-juli-2024/
1;24-Jul-24;Anak 12 Tahun Kecanduan Judi Online dan Selalu Menang;Beredar sebuah video di media sosial Facebook yang mengeklaim anak 12 tahun kecanduan bermain judi online dan selalu menang. Dalam video juga orang tua mengaku tidak marah anaknya kecanduan judi online karena selalu menang.;https://ppid.diskominfo.jatengprov.go.id/isu-hoaks-disinformasi-24-juli-2024/
1;24-Jul-24;Pencarian Partisipan pada HUT Ke-79 RI di IKN;Beredar sebuah undangan di aplikasi perpesanan WhatsApp yang berisikan undangan untuk ikut berpartisipasi pada upacara 17 Agustus 2024 yang akan diselenggarakan di Ibu Kota Nusantara (IKN).;https://ppid.diskominfo.jatengprov.go.id/isu-hoaks-disinformasi-24-juli-2024/
1;24-Jul-24;Seluruh Pembangunan IKN akan Dihentikan Mulai 10 Agustus 2024;Beredar sebuah unggahan video di media sosial Tiktok yang mengklaim bahwa proyek pembangunan IKN berhenti mulai 10 Agustus 2024.;https://ppid.diskominfo.jatengprov.go.id/isu-hoaks-disinformasi-24-juli-2024/
1;24-Jul-24;Utang Indonesia Sudah Tembus Rp12000 Triliun;Beredar sebuah video di platform YouTube yang membagikan sebuah klaim jika utang Indonesia telah mencapai angka Rp12000 triliun.;https://ppid.diskominfo.jatengprov.go.id/isu-hoaks-disinformasi-24-juli-2024/
1;25-Jul-24;Akun Facebook Mengatasnamakan Rektor Universitas Negeri Makassar;Beredar akun Facebook mengatasnamakan Rektor Universitas Negeri Makassar (UNM) Prof. Karta Jayadi. Akun tersebut menawarkan bantuan pembangunan masjid, pondok pesantren, ataupun tempat ibadah lainnya.;https://ppid.diskominfo.jatengprov.go.id/isu-hoaks-disinformasi-25-juli-2024/
1;25-Jul-24;Daftar Merek Mobil yang Dilarang Pakai BBM Bersubsidi;Beredar sebuah unggahan di media sosial Facebook yang mengeklaim bahwa terdapat beberapa merek mobil yang dilarang menggunakan bahan bakar minyak (BBM) bersubsidi mulai 17 Agustus 2024. Dalam unggahannya ditulis ada 10 merek mobil yang dilarang memakai BBM subsidi.;https://ppid.diskominfo.jatengprov.go.id/isu-hoaks-disinformasi-25-juli-2024/
1;25-Jul-24;Klaim tentang Rohingya Menguasai 20 Persen Tanah di Indonesia;Beredar sebuah unggahan di media sosial Instagram yang membagikan sebuah tautan dari platform Snack Video tentang etnis Rohingya. Dalam keterangan video dituliskan bahwa 20% tanah Indonesia sudah berhasil dimiliki oleh etnis Rohingnya;https://ppid.diskominfo.jatengprov.go.id/isu-hoaks-disinformasi-25-juli-2024/
1;25-Jul-24;Massa Geruduk KPK Bawa Bukti Korupsi 20T Di IKN;Beredar sebuah unggahan video di media sosial Youtube dengan narasi yang menyatakan bahwa massa geruduk KPK dengan membawa bukti korupsi sebesar Rp20 triliun yang terjadi di Ibu Kota Nusantara (IKN). Klaim tersebut diperkuat dengan gambar thumbnail yang menampilkan kerumunan massa di Kantor KPK.;https://ppid.diskominfo.jatengprov.go.id/isu-hoaks-disinformasi-25-juli-2024/
1;25-Jul-24;Perubahan Tarif Transaksi BRI;Beredar kembali sebuah unggahan di media sosial Twitter dengan narasi adanya kenaikan biaya transaksi antar bank dari Bank Rakyat Indonesia menjadi Rp150.000 per-bulan.;https://ppid.diskominfo.jatengprov.go.id/isu-hoaks-disinformasi-25-juli-2024/
1;25-Jul-24;Pesan WhatsApp Mengatasnamakan Kapolres Sigi AKBP Reja A Simanjuntak;Beredar akun WhatsApp yang mengatasnamakan Kepala Kepolisian Resor (Kapolres) Sigi Ajun Komisaris Besar Polisi (AKBP) Reja A Simanjuntak. Terlihat akun tersebut menggunakan nama dan foto profil AKBP Reja A Simanjuntak.;https://ppid.diskominfo.jatengprov.go.id/isu-hoaks-disinformasi-25-juli-2024/
1;26-Jul-24;Akun WhatsApp Mengatasnamakan Camat Mandau Riki Rihardi, S.STP., M.Si;Beredar akun WhatsApp mengatasnamakan Camat Mandau Riki Rihardi, S.STP., M.Si. Terlihat akun tersebut menggunakan nama dan foto dari Riki Rihardi, S.STP., M.Si dengan nomor +6282336037455.;https://ppid.diskominfo.jatengprov.go.id/isu-hoaks-disinformasi-26-juli-2024/
1;26-Jul-24;Bali Mendadak Hancur Akibat Badai Mengerikan;Beredar sebuah video di platform Youtube yang diunggah pada tanggal 22 Juli 2024 dengan narasi yang mengeklaim Pulau Bali mendadak hancur akibat badai mengerikan.;https://ppid.diskominfo.jatengprov.go.id/isu-hoaks-disinformasi-26-juli-2024/
1;26-Jul-24;Gebyar Undian Bank NTT;Beredar sebuah unggahan di media sosial Facebook yang membagikan informasi terkait undian berhadiah yang diadakan oleh Bank Pembangunan Daerah Nusa Tenggara Timur atau Bank NTT. Akun tersebut juga turut membagikan tautan untuk diakses.;https://ppid.diskominfo.jatengprov.go.id/isu-hoaks-disinformasi-26-juli-2024/
1;26-Jul-24;Parfum, Pengharum Ruangan dan Parfum Dry Cleaning Menyebabkan Kanker;Seorang wanita muda yang gemar parfum mengalami kanker paru-paru akibat bahan kimia dalam parfum tersebut. Penyakitnya tidak kunjung sembuh, menyoroti risiko kesehatan dari penggunaan pewangi kimia.;https://web.facebook.com/iin.indaryati.37/posts/pfbid02QC64A3SToeyFXaHMfg8cBtBbXeCQ4tfN6VaYTLnEu5YucJabk7ahnQ3jNn6i8JzKl?_rdc=1&_rdr
1;26-Jul-24;Undian Berhadiah Mobil Mengatasnamakan Bank BJB;Beredar sebuah informasi berisi klaim undian berhadiah tabungan dari Bank BJB. Dalam informasi yang beredar, disebutkan hadiah yang akan dibagikan berupa beberapa unit mobil dengan berbagai merk.;https://ppid.diskominfo.jatengprov.go.id/isu-hoaks-disinformasi-26-juli-2024/
1;26-Jul-24;Warna Tutup Botol Air dalam Kemasan Menandakan Jenis Airnya;Beredar sebuah unggahan di media sosial Facebook yang mengeklaim warna tutup botol air minum dalam kemasan menandakan jenis air.;https://ppid.diskominfo.jatengprov.go.id/isu-hoaks-disinformasi-26-juli-2024/
1;27-Jul-24;Akun Facebook Mengatasnamakan Anggota DPRD Sulawesi Selatan Yasir Mahmud;Beredar akun media sosial Facebook yang mengatasnamakan salah satu anggota Dewan Perwakilan Rakyat Daerah (DPRD) terpilih 2024-2029 Yasir Mahmud. Menjelang Pemilihan Kepala Daerah (Pilkada), akun tersebut muncul di media sosial. Akun tersebut menggunakan nama dan foto profil Yasir Mahmud bersama istrinya dengan menawarkan bantuan pembangunan masjid, pondok pesantren, ataupun tempat ibadah lainnya.;https://ppid.diskominfo.jatengprov.go.id/isu-hoaks-disinformasi-27-juli-2024-2/
1;27-Jul-24;Akun WhatsApp Mengatasnamakan Kepala DPMPTSP Kabupaten Cirebon Dede Sudiono;Beredar akun WhatsApp mengatasnamakan Kepala Dinas Penanaman Modal dan Pelayanan Terpadu Satu Pintu (DPMPTSP) Kabupaten Cirebon Dede Sudiono. Terlihat akun tersebut menggunakan nama dan foto Dede Sudiono;https://ppid.diskominfo.jatengprov.go.id/isu-hoaks-disinformasi-27-juli-2024-2/
1;27-Jul-24;Gunung Ciremai akan Meletus akibat Gempa Susulan di Kabupaten Kuningan;Beredar sebuah pesan di media sosial WhatsApp membicarakan tentang akan adanya potensi meletusnya Gunung Ciremai. Diketahui dari obrolan tersebut bahwa hal tersebut terjadi dikarenakan gempa susulan yang akan terjadi di daerah Kabupaten Kuningan, Provinsi Jawa Barat.;https://ppid.diskominfo.jatengprov.go.id/isu-hoaks-disinformasi-27-juli-2024-2/
1;27-Jul-24;Tautan Situs untuk Memilih Biaya Admin Bulanan BRI;Beredar pesan di aplikasi WhatsApp yang menyertakan sebuah tautan situs yang diklaim sebagai formulir untuk memilih biaya administrasi bulanan layanan perbankan di Bank Rakyat Indonesia (BRI). Saat mengakses tautan tersebut, nasabah dimintai persetujuannya untuk memilih kategori biaya administrasi bulanan yang disukai.;https://ppid.diskominfo.jatengprov.go.id/isu-hoaks-disinformasi-27-juli-2024-2/
1;27-Jul-24;Video Pondok Pesantren Nurul Fazri di Kecamatan Caringin, Kabupaten Sukabumi Terbakar;Beredar sebuah unggahan di media sosial X/Twitter berisi video yang menunjukkan sebuah bangunan terbakar, serta dilengkapi keterangan bahwa bangunan itu adalah Pondok Pesantren di Kecamatan Caringin, Kabupaten Sukabumi, yang dibakar oleh segerombol orang tak dikenal.;https://ppid.diskominfo.jatengprov.go.id/isu-hoaks-disinformasi-27-juli-2024-2/
1;28-Jul-24;Akun WhatsApp Mengatasnamakan Kepala Dinas BPKAD Kabupaten Garut Erna Sugiarti;Beredar akun WhatsApp mengatasnamakan Kepala Dinas Badan Pengelolaan Keuangan dan Aset Daerah (BPKAD) Kabupaten Garut Erna Sugiarti. Terlihat akun tersebut menggunakan nama dan foto Erna Sugiarti.;https://ppid.diskominfo.jatengprov.go.id/isu-hoaks-disinformasi-28-juli-2024/
1;28-Jul-24;Flyer Festival Seni Budaya Mengatasnamakan Dinas Koperasi dan UMKM Kota Bandung;Beredar sebuah selebaran di media sosial berisi informasi mengenai penyelenggaraan pameran yang mengatasnamakan Dinas Koperasi dan UMKM (Usaha Mikro Kecil dan Menengah) Kota Bandung. Flyer tersebut memuat tanggal pelaksanaan kegiatan dan bazar UMKM serta kontak yang dapat dihubungi.;https://ppid.diskominfo.jatengprov.go.id/isu-hoaks-disinformasi-28-juli-2024/
1;28-Jul-24;Pertalite Akan Dihapus pada 17 Agustus 2024;Beredar sebuah unggahan di media sosial X/Twitter narasi yang menyebutkan bahwa pada tanggal 17 Agustus 2024, Pertalite akan dihapuskan.;https://ppid.diskominfo.jatengprov.go.id/isu-hoaks-disinformasi-28-juli-2024/
1;28-Jul-24;Tautan Pembelajaran Gratis yang Mengatasnamakan Plataran Sehat Kemenkes;Beredar sebuah pesan berantai melalui WhatsApp yang berisi informasi mengenai link atau tautan situs untuk mengikuti pembelajaran digital gratis yang diselenggarakan oleh Plataran Sehat Kementerian Kesehatan (Kemenkes). Dalam pesannya juga disebut bahwa masyarakat wajib mengunggah aplikasi yang terdapat di tautan tersebut untuk bisa masuk ke akun Plataran Sehat.;https://ppid.diskominfo.jatengprov.go.id/isu-hoaks-disinformasi-28-juli-2024/
1;29-Jul-24;Akun WhatsApp Mengatasnamakan Kepala Kejari Kabupaten Blitar Muhamad Yunus;Beredar akun WhatsApp mengatasnamakan Kepala Kejaksaan Negeri (Kejari) Kabupaten Blitar Muhamad Yunus. Terlihat akun tersebut menggunakan foto Muhamad Yunus dengan nomor +6285754570621. Akun tersebut menghubungi sejumlah kepala dinas, camat, anggota DPRD, dan pengusaha di Kabupaten Blitar.;https://ppid.diskominfo.jatengprov.go.id/isu-hoaks-disinformasi-29-juli-2024/
1;29-Jul-24;Jokowi Bagi-Bagi Uang Untuk Pemegang Buku Rekening BCA, BNI, BRI, dan Bank Mandiri;Beredar sebuah unggahan di media sosial TikTok mengenai informasi Presiden Joko Widodo (Jokowi) yang akan membagikan uang Rp100 juta kepada masyarakat yang memiliki buku rekening BCA (Bank Central Asia), BNI (Bank Negara Indonesia), BRI (Bank Rakyat Indonesia), dan Bank Mandiri.;https://ppid.diskominfo.jatengprov.go.id/isu-hoaks-disinformasi-29-juli-2024/
1;29-Jul-24;Lowongan Kerja BPN Tenaga PPNPN;Beredar sebuah poster yang mengeklaim adanya rekrutmen lowongan kerja Badan Pertahanan Nasional (BPN) untuk lulusan SMA, SMK, D3, dan S1 sebagai Tenaga Pegawai Pemerintah Non Pegawai Negeri (PPNPN).;https://ppid.diskominfo.jatengprov.go.id/isu-hoaks-disinformasi-29-juli-2024/
1;29-Jul-24;Pertandingan Indonesia vs Belanda pada 25 Juli 2024;Beredar sebuah video di platform TikTok yang mengeklaim akan diadakan pertandingan sepak bola antara Tim Nasional (Timnas) Indonesia melawan Belanda. Pertandingan itu disebut akan diselenggarakan pada tanggal 25 Juli 2024 di stadion Gelora Bung Karno (GBK).;https://ppid.diskominfo.jatengprov.go.id/isu-hoaks-disinformasi-29-juli-2024/
1;29-Jul-24;Pesan WhatsApp Mengatasnamakan Pejabat Kejaksaan Negeri Kabupaten Ngada;Beredar pesan WhatsApp yang mengatasnamakan pejabat Kejaksaan Negeri Kabupaten Ngada. Dalam pesan tersebut pelaku meminta sejumlah uang yakni sebesar Rp2 juta rupiah atas arahan Kepala Kejaksaan Negeri (Kajari).;https://ppid.diskominfo.jatengprov.go.id/isu-hoaks-disinformasi-29-juli-2024/
1;29-Jul-24;Pinjaman Dana Tunai Online Mengatasnamakan Maybank Finance;Beredar sebuah pesan WhatsApp yang membagikan informasi mengenai pinjaman dana tunai online yang mengatasnamakan Maybank Finance. Dalam pesannya juga dicantumkan nomor bagian marketing yang dapat dihubungi yakni 085343671517.;https://ppid.diskominfo.jatengprov.go.id/isu-hoaks-disinformasi-29-juli-2024/
1;29-Jul-24;Video Tanah IKN Dijahit;Beredar sebuah video di media sosial Facebook yang memperlihatkan proses pengerjaan tanah dengan menggunakan benda semacam tali lebar yang dimasukkan ke dalamnya. Dalam narasinya, akun tersebut menuliskan sebuah narasi yang berbunyi ÒCuman d IKN tanah di jahitÓ.;https://ppid.diskominfo.jatengprov.go.id/isu-hoaks-disinformasi-29-juli-2024/
1;30-Jul-24;Aktivasi Identitas Kependudukan Digital (IKD) melalui WhatsApp;Beredar unggahan tangkapan layar adanya panggilan WhatsApp yang mengeklaim mengatasnamakan petugas aktivasi Identitas Kependudukan Digital (IKD).;https://ppid.diskominfo.jatengprov.go.id/isu-hoaks-disinformasi-30-juli-2024/
