Label;Tanggal;Judul;Narasi;Source
1;18-Mar-24;Puskesmas Sewon I Kabupaten Bantul Membuka Lowongan Pekerjaan;"Beredar sebuah unggahan di media sosial Facebook informasi Puskesmas Sewon I, Kecamatan Sewon, Kabupaten Bantul, Provinsi Daerah Istimewa (DI) Yogyakarta membuka lowongan pekerjaan. Narasi yang beredar Puskesmas Sewon I membutuhkan staf kantor dan pramukantor. Syarat untuk pelamar pun cukup mudah yaitu wanita berusia maksimal 35 tahun dan minimal memiliki ijazah SMA/SMK.
";https://turnbackhoax.id/2024/03/17/salah-puskesmas-sewon-i-membuka-lowongan-pekerjaan/
1;18-Mar-24;"Video Sekelompok Preman Mendatangi Masjid
";"Beredar beberapa unggahan video di media sosial Facebook yang mengeklaim bahwa sekelompok preman mendatangi masjid dan melecehkan tempat ibadah. Unggahan tersebut turut memuat narasi ""Dimana menteri agamanya.....masjid tempat ibadah umat Islam sedang di lecehkan oleh para preman.... VIRAL KAN""
";https://www.kompas.com/cekfakta/read/2024/03/16/183600982/-hoaks-video-sekelompok-preman-mendatangi-masjid
1;19-Mar-24;Gempa Bumi Berkekuatan 10,1 Magnitudo Mengguncang Provinsi Aceh pada Maret 2024;"Beredar sebuah unggahan video di platform YouTube yang mengeklaim bencana gempa bumi mengguncang Provinsi Aceh dengan kekuatan 10,1 magnitudo. Gambar thumbnail video menampilkan kondisi gedung dan bangunan yang runtuh akibat bencana gempa bumi.
";https://turnbackhoax.id/2024/03/18/salah-gempa-101-magnitude-guncang-aceh-1-maret-2024/
1;19-Mar-24;Nata de Coco Terbuat dari Plastik;"Beredar sebuah unggahan video di media sosial Facebook yang memperlihatkan seorang pria sedang memegang produk nata de coco merek Yeko dan menginformasikan produk nata de coco sintetis yang terbuat dari plastik. Unggahan tersebut disertakan narasi ""Waspada konsumsi plastik ""nata de coco"" #keephealthy""";https://www.kompas.com/cekfakta/read/2024/03/18/180325982/hoaks-nata-de-coco-terbuat-dari-plastik
1;19-Mar-24;Penggalangan Dana Pemilik Xpander yang Menabrak Porsche Melalui Kitabisa;Beredar di media sosial gambar tangkapan layar aplikasi Kitabisa yang membuka penggalangan dana pemilik mobil Xpander yang menabrak Porsche untuk ganti rugi sebesar Rp9 miliar. ;https://www.kompas.com/tren/read/2024/03/18/103000965/ramai-soal-pemilik-xpander-tabrak-porsche-disebut-lakukan-galang-dana-ini
1;19-Mar-24;"Terdapat Kandungan Darah Babi pada Filter Rokok
";"Beredar pesan berantai di aplikasi percakapan WhatsApp yang menginformasikan bahwa terdapat penelitian yang mengungkapkan adanya kandungan darah babi yang terdapat pada filter yang dipakai pada rokok. Pesan berantai tersebut beredar dengan narasi ""Mohon untuk share video ini..kita sebagai UMAT MUSLIM jangan sampai mengkonsumsi yang sudah diharamkan oleh agamaa!!! Penelitian: Filter rokok berasal dari Darah Babi Profesor Kesehatan Masyarakat dari Universitas Sydney, Australia, Simon Chapman memperingatkan
kelompok agama tertentu terkait dugaan adanya kandungan sel darah babi pada filter rokok"".";https://turnbackhoax.id/2024/03/18/salah-filter-rokok-mengandung-darah-babi/
1;19-Mar-24;Uang Kertas Emisi Terbaru Bergambar Sri Mulyani;"Beredar beberapa unggahan informasi di media sosial Facebook yang mengeklaim bahwa terdapat uang kertas emisi terbaru bergambar Menteri Keuangan (Menkeu) Sri Mulyani. Terlihat dalam salah satu unggahan tersebut narasi ""Bakal ada uang baru tahun ini"" disertai perubahan sejumlah pecahan mata uang rupiah.";https://www.kompas.com/cekfakta/read/2024/03/19/132400382/-hoaks-uang-kertas-emisi-terbaru-bergambar-sri-mulyani
1;20-Mar-24;Gempa Berkekuatan 10,9 Magnitudo Hancurkan Ribuan Rumah di Kota Kupang;Beredar sebuah video di platform YouTube yang mengeklaim bahwa telah terjadi gempa dengan kekuatan 10,9 magnitudo yang menghancurkan ribuan rumah di Kota Kupang.;https://turnbackhoax.id/2024/03/20/salah-gempa-di-kupang-mencapai-kekuatan-109-magnitudo-hancurkan-ribuan-rumah/
1;20-Mar-24;NASA Prediksi Kiamat Internet pada 2025;"Beredar sebuah unggahan foto di media sosial X/Twitter yang mengeklaim Badan Penerbangan dan Antariksa (NASA) Amerika Serikat menyebutkan akan terjadi kiamat internet pada 2025. Unggahan foto tersebut
menampilkan sebuah gedung dan menara pembangkit listrik serta narasi ""Beredar kabar NASA peringatkan Kiamat Internet selama berbulan-bulan terjadi pada tahun
2025""";https://cekfakta.tempo.co/fakta/2825/keliru-konten-dengan-klaim-nasa-prediksi-ki
1;20-Mar-24;Pembakaran Polsek di Kecamatan Pidie Provinsi Aceh Akibat Sabotase Suara Rakyat dan Penggelembungan Suara Paslon Nomor Urut 02;Beredar sebuah video di media sosial Facebook yang menampilkan cuplikan kebakaran rumah dengan klaim pembakaran Kepolisian Sektor (Polsek) di Kecamatan Pidie, Kabupaten Pidie, Provinsi Aceh karena adanya sabotase dan penggelembungan suara dari pasangan calon (paslon) nomor urut 02.;https://turnbackhoax.id/2024/03/20/salah-terjadi-pembakaran-polsek-di-aceh-pidie-akibat-sabotase-suara-rakyat-dan-penggelembungan-suara-paslon-02/
1;20-Mar-24;Remaja di Kecamatan Jatinangor Tewas Akibat Perang Sarung;"Beredar di media sosial Facebook sebuah unggahan foto memperlihatkan seorang remaja terbaring dan sejumlah orang dewasa mengelilinginya beserta narasi yang
mengeklaim adanya seorang remaja yang tewas akibat perang sarung di Kecamatan Jatinangor, Kabupaten Sumedang, Provinsi Jawa Barat. 
";https://jabar.tribunnews.com/2024/03/20/viral-kabar-remaja-jatinangor-sumedang-tewas-dalam-perang-sarung-polisi-ungkap-yang-sebenarnya
1;20-Mar-24;Surat Permohonan Pengambilan Cuti Pekerja Migran Indonesia Mengatasnamakan BP2MI;Beredar surat permohonan pengambilan cuti pekerja migran Indonesia yang mengatasnamakan Badan Perlindungan Pekerja Pekerja Migran Indonesia (BP2MI). Surat tersebut menggunakan logo BP2MI yang berisi biaya pembuatan surat perjalanan.;https://www.instagram.com/p/C4o90NPSVP2/
1;20-Mar-24;Video Kerusuhan di Pertambangan Kabupaten Morowali, Provinsi Sulawesi Tengah;Beredar sebuah video di media sosial Facebook yang menampilkan kerumunan massa merusak beberapa mobil yang terparkir di sebuah pabrik. Video tersebut disertai narasi yang menyebut kerusuhan itu terjadi di area pertambangan di Kabupaten Morowali, Provinsi Sulawesi Tengah dan dibagikan pada 9 Maret 2024.;https://www.kompas.com/cekfakta/read/2024/03/19/164000582/-hoaks-video-kerusuhan-di-pertambangan-morowali-sulawesi-tengah#google_vignette
1;21-Mar-24;Bantuan Dana Rp125 Juta untuk Peserta BPJS Kesehatan;Beredar di media sosial Facebook unggahan poster menyertakan nama dan foto yang diklaim sebagai Prof. Drs. Muh Bakri, Msi sebagai Direktur Badan Penyelenggara Jaminan Sosial (BPJS) Kesehatan. Poster tersebut memuat informasi yang menyebut BPJS Kesehatan mengeluarkan dana bantuan sebesar Rp25 triliun untuk masyarakat seluruh indonesia dengan dana yang diterima oleh setiap penerima dana bantuan yang sudah didaftarkan sebanyak Rp125 juta.;https://www.kompas.com/cekfakta/read/2024/03/21/083500882/-hoaks-bantuan-da
1;21-Mar-24;Gebyar Undian Berhadiah Mengatasnamakan Bank BJB Syariah;"Beredar sebuah unggahan informasi di media sosial Facebook yang mengeklaim bahwa terdapat gebyar undian berhadiah mengatasnamakan Bank Pembangunan
Daerah Jawa Barat dan Banten (BJB) Syariah. Unggahan informasi yang beredar tersebut turut melampirkan sebuah laman serta mencatut gambar dan nama Bupati
dan Wakil Bupati Kabupaten Bandung, Provinsi Jawa Barat, yakni H. M. Dadang Supriatna dan H. Sahrul Gunawan";https://turnbackhoax.id/2024/03/20/salah-gebyar-hadiah-bank-bjb-syariah/
1;21-Mar-24;"Tautan Cara Aktivasi DANA Paylater
";"Beredar unggahan di media sosial Facebook yang memberikan tautan cara aktivasi DANA Paylater yang dapat memberikan pinjaman hingga 10 juta. Dalam unggahan tersebut mengajak agar pengguna mengaktifkan layanan tersebut dengan mengunjungi tautan yang dibagikan.
";https://www.dana.id/help-center/lainnya/mengapa-tidak-ada-fitur-dana-paylater-di-aplikasi-dana-saya
1;21-Mar-24;Video Gempa Berkekuatan 10,9 Magnitudo Guncang Wilayah Provinsi Jawa Tengah dan Sebabkan Kabupaten Pangandaran Tamat;"Beredar sebuah unggahan informasi yang mengeklaim bahwa gempa berkekuatan 10,9 magnitudo mengguncang wilayah Provinsi Jawa Tengah sehingga menyebabkan Kabupaten Pangandaran, Provinsi Jawa Barat tamat.
Dalam unggahan tersebut termuat narasi ""BARU SAJA PANGANDARAN TAMAT,GEMPA MAGNITUDE 10,9 GUNCANG JAWA TENGAH""";https://turnbackhoax.id/2024/03/20/salah-pangandaran-tamat-karena-jawa-tengah-diguncang-gempa-109-magnitude/
1;22-Mar-24;Bantuan Dana Senilai Rp100 Juta Diberikan untuk Tenaga Kerja Indonesia Mengatasnamakan Kementerian Kesehatan;"Beredar sebuah informasi di media sosial Facebook yang mengeklaim bahwa terdapat dana bantuan senilai Rp100 juta yang akan diberikan kepada tenaga kerja Indonesia (TKI) oleh Kementerian Kesehatan (Kemenkes). Unggahan tersebut bertuliskan ""Untuk seluruh pejuang devisa indonesia untuk penerimaan dana bansosnya di persilahkan menghubugi bpjs ketenagakerjaan..Terimah kasih...""
";https://www.kompas.com/cekfakta/read/2024/03/21/173500182/-hoaks-bantuan-dana-rp-100-juta-untuk-tki-mengatasnamakan-kemenkes?page=all#page2
1;22-Mar-24;Menghina Presiden Dikenakan Sanksi Masuk Daftar Hitam Tujuh Turunan;Beredar sebuah video di platform TikTok yang mengeklaim bahwa perbuatan menghina presiden akan kena sanksi dan masuk daftar hitam hingga tujuh turunan.;https://jalahoaks.jakarta.go.id/detail/HOAKS-Menghina-Presiden-Kena-Sanksi-Masuk-Daftar
1;22-Mar-24;Prabowo-Gibran Diputuskan Tidak Boleh Jadi Presiden dan Wakil Presiden oleh Mahkamah Internasional;"Beredar sebuah video yang menampilkan cuplikan pembacaan sebuah berita dari Metro TV terkait salah satu anggota sidang Komite Hak Asasi Manusia (HAM) Perserikatan Bangsa-Bangsa (PBB) yang menyoroti netralitas Presiden RI Joko Widodo dalam Pemilihan
Umum (Pemilu) 2024. Unggahan tersebut disertai dengan klaim Prabowo Subianto-Gibran Rakabuming Raka diputuskan tidak boleh jadi presiden dan wakil presiden oleh Mahkamah Internasional.";https://turnbackhoax.id/2024/03/22/salah-prabowo-gibran-diputuskan-tidak-boleh-jadi-presiden-dan-wakil-presiden-oleh-mahkamah-internasional/
1;22-Mar-24;Presiden Jokowi Gadaikan Pulau Kalimantan kepada Cina sebagai Jaminan Utang;"Beredar sebuah unggahan video di media sosial Facebook yang mengeklaim bahwa Presiden Joko Widodo (Jokowi) menggadaikan Pulau Kalimantan sebagai jaminan utang kepada negara Cina. Terlihat dalam unggahan video tersebut narasi ""PRESIDEN CHINA MEMINTA MEPADA BPK JOKOWI MENYERAHKAN TANAH KALIMANTAN SEBAGAI JAMINAN""
";https://turnbackhoax.id/2024/03/22/salah-jokowi-gadaikan-kalimantan-kepada-cina-sebagai-jaminan-hutang/
1;22-Mar-24;Rusuh Demo 20 Maret 2024 di Depan Gedung Komisi Pemilihan Umum;Beredar sebuah video di media sosial Facebook yang memperlihatkan kericuhan massa aksi yang diklaim merupakan kejadian di depan Gedung Komisi Pemilihan Umum (KPU) pada 20 Maret 2024;https://turnbackhoax.id/2024/03/22/salah-rusuh-demo-20-maret-2024-di-kpu/
1;22-Mar-24;Stanford University Akan Bangun Kampus di IKN;Beredar unggahan di media sosial Facebook dengan informasi yang mengeklaim bahwa Universitas Stanford akan membangun kampus di Ibu Kota Negara (IKN) Nusantara.;https://www.kompas.com/cekfakta/read/2024/03/16/122100882/-klarifikasi-stanford-bangun-pusat-riset-di-ikn-bukan-kampus
1;22-Mar-24;Uang Baru Hasil Redenominasi Dikeluarkan saat Lebaran 2024;Beredar video di media sosial TikTok yang menampilkan gambar uang yang berlaku di Indonesia dan uang baru yang akan beredar setelah redenominasi (penyederhanaan nilai mata uang rupiah tanpa mengubah nilai tukarnya). Dalam unggahan tersebut, mata uang Rp1.000 akan menjadi satu rupiah. Mata uang Rp50.000 akan menjadi Rp50 dan mata uang Rp100.000 akan menjadi seratus rupiah. Unggahan tersebut juga mengeklaim uang hasil redenominasi dikeluarkan dan sudah dipakai saat lebaran 2024;https://www.antaranews.com/berita/4021122/uang-baru-hasil-redenominasi-dikeluarkan-saat-lebaran-2024-benarkah
1;23-Mar-24;Mahfud MD : Jokowi antara Mati di Penjara, 10 Tahun Merusak Negara, Penjara Seumur Hidup, atau Digantung;"Beredar unggahan video di media sosial TikTok yang membagikan sebuah video yang menampilkan cuplikan Mahfud MD berkomentar dalam sebuah talkshow beserta dengan narasi ""Jokowi antara mati di penjara, 10 tahun merusak negara, Penjara seumur hidup, atau digantung""";https://turnbackhoax.id/2024/03/23/salah-mahfud-md-jokowi-antara-mati-di-penjar
1;23-Mar-24;"Menteri Agama Larang Tarawih dan Tadarus Menggunakan Pengeras Suara
";"Beredar sebuah unggahan di media sosial Facebook yang mengeklaim bahwa Menteri Agama (Menag) melarang tarawih dan tadarus menggunakan pengeras suara. Unggahan tersebut disertai narasi ""Dilarang pakai pengeras suara.. Apakah memang suaranya bikin panas ?? Tidak, justru bikin adem pikiran dan hati manusia. Semoga tidak mengurangi kualitas ibadah di bulan
ramadhan. Marhaban ya Ramadhan, Selamat menunaikan ibadah Ramadhan"".";https://www.kompas.com/cekfakta/read/2024/03/22/185500782/-hoaks-menag-larang-tarawih-dan-tadarus-pakai-pengeras-suara
1;23-Mar-24;Prabowo Subianto Membagikan Uang Senilai Rp5 Juta dalam Rangka Ramadhan 2024;Beredar unggahan video di media sosial TikTok yang mengeklaim bahwa Presiden terpilih Prabowo Subianto akan membagikan uang senilai Rp5 Juta kepada seluruh rakyat dalam rangka bulan Ramadan tahun 2024. Untuk mendapatkan uang tunai tersebut, harus mengikuti akun tersebut;https://turnbackhoax.id/2024/03/23/salah-uang-5-juta-dari-prabowo-dalam-rangka-ramadhan-2024/
1;23-Mar-24;Telur Rebus yang Berwarna Kehijauan Berbahaya;Beredar sebuah unggahan di media sosial Instagram yang mengklaim bahwa telur yang direbus sampai permukaan telurnya berwarna hijau berbahaya karena mengandung besi sulfida yang sulit untuk dicerna dan beresiko menyumbat usus.;https://tirto.id/benarkah-merebus-telur-dengan-air-panas-berbahaya-gWpC?fbclid=IwAR0UOjwBkOPLCBtpnAWMN6s361g6b7QXZRcur_OJHsanmNCLiA7p5s_oXEI
1;23-Mar-24;Video Kerusakan Parah Akibat Gempa Bumi di Kabupaten Tuban;Beredar pada platform TikTok unggahan video yang memperlihatkan rumah roboh dan jalan mengalami kerusakan parah hingga terbelah yang diklaim merupakan akibat dari gempa bumi di wilayah Kabupaten Tuban.;https://news.detik.com/berita/d-7256859/viral-video-rumah-jalan-rusak-akibat-gempa-tuban-bnpb-pastikan-hoax
1;24-Mar-24;Foto Rumah Warga Kecamatan Singgahan Roboh Akibat Gempa Bumi Kabupaten Tuban;Beredar pada aplikasi percakapan WhatsApp berupa foto bangunan rumah warga yang roboh dengan keterangan tempat di Kecamatan Singgahan dan dikaitkan sebagai akibat dari gempa bumi yang terjadi di Kabupaten Tuban pada Jumat, 22 Maret 2024.;https://diskominfo.tubankab.go.id/entry/hoaks-foto-beberapa-rumah-warga-singgahan-rubuh-akibat-gempa-bumi
1;24-Mar-24;Gelombang Tinggi Terjang Pulau Bali Hingga Hanyut;Beredar sebuah unggahan video pada platform YouTube yang mengeklaim bahwa terjadi gelombang tinggi yang telah menerjang Pulau Bali hingga hanyut.;https://turnbackhoax.id/2024/03/24/salah-gelombang-tinggi-terjang-bali-hingga-hanyut/
1;24-Mar-24;"Prediksi Gempa di Kabupaten Tuban Lebih Besar
";Beredar tangkapan layar pesan berantai dari WhatsApp yang mengeklaim akan terjadi gempa bumi lebih besar di Kabupaten Tuban. Dalam pesan tersebut terdapat narasi yang menyebutkan pada waktu isya gempa akan lebih besar.;https://klinikhoaks.jatimprov.go.id/post/hoaks-prediksi-gempa-di-tuban-lebih-besar-65fe4678aa033#
1;24-Mar-24;Tautan Pendaftaran BLT PKH Tambahan;Beredar pesan berantai melalui aplikasi percakapan WhatsApp berisi tautan untuk melakukan pendaftaran Bantuan Langsung Tunai (BLT) Program Keluarga Harapan (PKH) tambahan sebesar Rp400.000. Pendaftar diminta untuk mendaftarkan data pribadi ke tautan tersebut agar bisa mendapatkan BLT PKH tambahan secara langsung.;https://turnbackhoax.id/2024/03/23/salah-bantuan-tambahan-blt-pkh-tahap-1-rp400-000/
1;24-Mar-24;Tidak Ada Bantuan Pemerintah untuk Korban Banjir Kabupaten Demak;"Beredar sebuah unggahan video di media sosial TikTok yang mengeklaim tidak ada bantuan dari pemerintah untuk korban banjir di Kabupaten Demak yang terjadi pada 13 Maret 2024. Unggahan tersebut disertakan narasi ""Tidak ada bansos, tidak ada bagi-bagi sembako, tidak ada perhatian khusus karena Pilpres sudah selesai"".";https://turnbackhoax.id/2024/03/23/salah-tidak-ada-bantuan-pemerintah-untuk-korban-banjir-demak/
1;25-Mar-24;Gedung Bawaslu Dibakar Massa karena Tolak Hasil Pemilu 2024;"Beredar sebuah unggahan video di platform TikTok yang mengeklaim bahwa Gedung Badan Pengawas Pemilihan Umum (Bawaslu) dibakar oleh massa yang menolak hasil Pemilihan Umum (Pemilu) 2024. Terlihat dalam unggahan video tersebut narasi ""innalillahi. semua ini ulah drakor Jokowi. Allahuakbar 100x. Gedung Bawaslu dibakar, Mobil plat merah dibakar, Diskualifikasi Pragib"".";https://turnbackhoax.id/2024/03/24/salah-massa-membakar-gedung-bawaslu-tolak-hasil-pemilu-2024/
1;25-Mar-24;Ombak Ganas Menerjang Sulawesi Utara;"Beredar sebuah unggahan video pada platform YouTube yang mengeklaim bahwa ombak ganas telah menerjang dan menghancurkan Provinsi Sulawesi Utara (Sulut).
Diklaim pula bahwa Badan Meteorologi, Klimatologi, dan Geofisika (BMKG) telah mengeluarkan peringatan dini gelombang tinggi di perairan Sulut hingga 21 Maret
2024.";https://turnbackhoax.id/2024/03/24/salah-ombak-ganas-terjang-sulawesi-utara-hingga-ludes/
1;25-Mar-24;"Undian Berhadiah Mengatasnamakan Bank Mandiri
";Beredar sebuah unggahan foto di media sosial Facebook yang mengeklaim adanya undian berhadiah dari Bank Mandiri. Nasabah dapat melakukan pendaftaran undian tersebut dengan mengeklik tautan yang tersedia.;https://www.kompas.com/cekfakta/read/2024/03/23/174106182/hoaks-tautan-undian-berhadiah-mengatasnamakan-bank-mandiri
1;25-Mar-24;Video Cara Mengetahui Tingkat Kejantanan dan Jumlah Hormon Kesuburan Melalui Kuku;"Beredar unggahan video di media sosial Facebook yang mengeklaim bahwa tingkat kejantanan pada pria dan jumlah hormon kesuburan pada pria dapat dilihat dari ""bulan sabit"" atau lunula yang ada pada kuku pria. Dalam video tersebut dijelaskan bahwa pria dikatakan jantan atau memiliki hormon kesuburan yang tinggi apabila lunula terdapat pada ibu jari tangan saja, tanpa ada di jari lain.
";https://cekfakta.tempo.co/fakta/2835/menyesatkan-narasi-soal-cara-mengetahui-tingkat-kejantanan-dan-jumlah-hormon-kesuburan-melalui-kuku
1;25-Mar-24;Video Istana Negara Rata Dengan Tanah Ternyata Sri Mulyani Temukan Dokumen Ini;Beredar sebuah unggahan video dengan klaim narasi bahwa Istana Negara telah rata dengan tanah dan Sri Mulyani temukan suatu dokumen. Thumbnail pada video tersebut menampilkan aksi bentrokan yang terjadi antara kepolisian dan pengunjuk rasa.;https://turnbackhoax.id/2024/03/24/salah-istana-rata-dengan-tanah-ternyata-sri-mulyani-temukan-dokumen-ini/
1;26-Mar-24;CNN: Mahkamah Konstitusi Tolak Gugatan Soal Pernikahan Beda Dimensi;Beredar sebuah unggahan video di sosial media TikTok yang menunjukkan tangkapan layar berita CNN Indonesia yang memberitakan bahwa Mahkamah Konstitusi (MK) tolak gugatan soal pernikahan beda dimensi. Terlihat dalam tangkapan layar tersebut Anwar Usman, Ketua MK masa jabatan 2018-2023, seperti sedang membacakan putusan MK dalam sebuah persidangan.;https://turnbackhoax.id/2024/03/26/salah-cnn-mk-tolak-gugatan-soal-pernikahan-beda-dimensi/
1;26-Mar-24;Kemunculan Api dari Dalam Bumi setelah Gempa di Kota Tuban;Beredar unggahan video di media sosial Facebook yang mengeklaim bahwa percikan api muncul dari dalam bumi setelah terjadinya gempa di Kota Tuban, Provinsi Jawa Timur.;https://www.liputan6.com/cek-fakta/read/5558157/cek-fakta-tidak-benar-kemuncul
1;26-Mar-24;Mensos Risma Bongkar Dana Bansos Presiden Jokowi Sebesar Rp400 Triliun demi Kemenangan Prabowo-Gibran;Beredar sebuah video di platform YouTube yang mengeklaim bahwa Menteri Sosial (Mensos) Tri Rismaharini membongkar dana bantuan sosial (bansos) Presiden Joko Widodo (Jokowi) sebesar Rp400 triliun demi kemenangan pasangan Prabowo Subianto-Gibran Rakabuming Raka pada pemilihan presiden (pilpres) 2024.;https://turnbackhoax.id/2024/03/25/salah-risma-bongkar-dana-bansos-jokowi-400t-demi-kemenangan-prabowo-gibran/
1;26-Mar-24;"NASA Berencana Semprotkan Partikel Es ke Atmosfer untuk Kurangi Dampak Perubahan Iklim
";"Beredar unggahan di media sosial Facebook yang mengeklaim bahwa The National Aeronautics and Space Administration (NASA) atau yang dikenal sebagai Badan Penerbangan dan Antariksa Amerika Serikat akan menyemprotkan 2 ton partikel es di ketinggian atmosfer pada tiap pekan. Hal tersebut dilakukan untuk membekukan air di atmosfer untuk menghilangkan uap air ekstra dan mengeringkan stratosfer, tempat air berubah menjadi gas dan menjadi emisi gas rumah kaca, yang menaikkan suhu bumi.
";https://jalahoaks.jakarta.go.id/detail/HOAKS-NASA-Semprotkan-Partikel-Es-ke-Atmosfer-untuk-Kurangi-Dampak-Perubahan-Iklim
1;27-Mar-24;Bumi akan Gelap selama Tiga Hari Mulai dari 8 April 2024;"Beredar di media sosial TikTok sebuah unggahan video yang mengeklaim bahwa bumi akan mengalami kegelapan selama 72 jam atau 3 hari mulai dari tanggal 8 April 2024 akibat dari fenomena bumi yang akan melewati ""Sabuk Foton"".
";https://sumselupdate.com/cek-fakta-hoaks-video-bumi-akan-gelap-tiga-hari-mulai-8-april-2024/
1;27-Mar-24;Gebyar Undian Ramadhan oleh Bank Mandiri;"Beredar sebuah unggahan pada media sosial Facebook dengan nama akun ""Gebyar Ramadhan"" yang mengeklaim bahwa Bank Mandiri sedang membuka program ÒGEBYAR UNDIAN RAMADHANÓ. Dalam narasi yang beredar disebutkan jika nasabah Bank Mandiri akan mendapatkan hadiah berupa emas batangan, mobil, motor, dan paket umroh dengan mengklik tautan yang dilampirkan pada unggahan tersebut.
";https://turnbackhoax.id/2024/03/27/salah-gebyar-undian-ramadhan-oleh-bank-mandiri/
1;27-Mar-24;Kondisi Kejiwaan Menhan Prabowo Subianto Terganggu karena Tertekan Suatu Masalah;"Beredar sebuah unggahan video di platform YouTube yang mengeklaim kejiwaan calon presiden (capres) Prabowo Subianto terganggu karena tertekan suatu masalah. Gambar thumbnail video memperlihatkan Prabowo Subianto yang dikawal Satuan Polisi Pamong Praja (Satpol PP) dan Presiden Joko Widodo (Jokowi) menggunakan kemeja berwarna putih. Unggahan video juga dilengkapi dengan narasi ""KEJIWAAN PRABOWO TERGUNCANG HEBAT. MENGENASKAN PRABOWO TERTEKAN MASALAH BESAR INI...!!"".";https://turnbackhoax.id/2024/03/26/salah-kejiwaan-prabowo-terguncang-karena-tertekan-masalah-ini/
1;27-Mar-24;Lowongan Kerja Puskesmas Semanding, Kabupaten Tuban;Beredar sebuah informasi pada media sosial Facebook mengenai lowongan kerja di Puskesmas Semanding, Kabupaten Tuban. Dalam unggahan itu disebutkan Puskesmas Semanding sedang membutuhkan staf dan pramubakti perempuan, dengan syarat minimal ijazah SMA/SMK/D3/S1. Dalam unggahan juga disertakan nomor telepon 082229833431 untuk info lebih lanjut.;https://klinikhoaks.tubankab.go.id/post/hoaks-informasi-lowongan-kerja-puskesmas-semanding-beredar-di-facebook-6600ddf01324c#blogdetail
1;27-Mar-24;"Pendaftaran Pesta Poin Berhadiah dari Bank Kalimantan Selatan
";Beredar sebuah unggahan di media sosial Facebook yang mendapati klaim pendaftaran pesta poin berhadiah dari Bank Kalimantan Selatan (Kalsel). ;https://www.liputan6.com/cek-fakta/read/5559573/cek-fakta-tidak-benar-pendaftaran-pesta-poin-berhadiah-bank-kalsel?page=2
1;27-Mar-24;Suporter Vietnam Melakukan Teror Kembang Api Dekat Hotel Timnas Indonesia;Beredar sebuah video disertai dengan narasi yang menyebutkan suporter Vietnam menyalakan kembang api di dekat hotel tempat Tim Nasional (Timnas) Sepak Bola Indonesia menginap. Aksi menyalakan kembang api tersebut sebagai aksi teror dan balas dendam yang dilakukan oleh suporter Vietnam.;https://www.kompas.com/cekfakta/read/2024/03/25/193900882/-klarifikasi-tidak-benar-suporter-vietnam-nyalakan-kembang-api-dekat?page=all
1;27-Mar-24;Video Anak Kecil Tewas Tersetrum Sepeda Listrik;"Beredar sebuah video di media sosial Facebook yang mengeklaim seorang anak kecil tewas tersetrum sepeda listrik.
";https://turnbackhoax.id/2024/03/26/salah-video-kesetrum-sepeda-listrik-meninggal-dunia/
1;29-Mar-24;Jepang Resmi Melarang Vaksinasi Covid-19 Berbasis mRNA;Beredar sebuah unggahan di media sosial Facebook dengan narasi yang mengeklaim bahwa negara Jepang telah resmi melarang penyuntikan vaksin Covid-19 berbasis messenger RNA (mRNA).;https://www.kompas.com/cekfakta/read/2024/03/28/182500082/-hoaks-jepang-larang-vaksinasi-covid-19-berbasis-mrna?page=all
1;29-Mar-24;Ketua DPR RI Puan Maharani Mengesahkan Hak Angket;Beredar sebuah unggahan pada media sosial TikTok yang memperlihatkan video mengenai Puan Maharani selaku Ketua Dewan Perwakilan Rakyat Republik Indonesia (DPR RI) telah mengesahkan hak angket DPR.;https://turnbackhoax.id/2024/03/29/salah-puan-sahkan-hak-angket/
1;29-Mar-24;Pemberian Donasi / Bantuan Mengatasnamakan Sekda Temanggung;Modus penipuan melalui chat Whatsapp yang menyampaikan informasi tentang Pemberian Donasi/Bantuan dari Pemkab Temanggung yang mengatasnamakan Bapak Sekda.;https://mediacenter.temanggungkab.go.id/berita/detail/hoax-pemberian-donasi--bantuan-mengatasnamakan-sekda-temanggung
1;29-Mar-24;Pemerintah Akan Berikan Tambahan BPNT Tahap 2 Sebesar Rp400 Ribu;Beredar di media sosial Facebook sebuah informasi mengenai pemberian tambahan Bantuan Pangan Non Tunai (BPNT) Tahap 2 sebesar Rp400 ribu dari pemerintah. Dalam pengumuman tersebut disebutkan bahwa pendaftaran dapat dilakukan melalui tautan yang disediakan dengan batas akhir pada 30 April 2024.;https://www.jabarnews.com/cek-fakta/cek-fakta-pemerintah-akan-berikan-tambahan-bpnt-tahap-2-rp-400-000/
